sentence,roi,notoriete,obligation,source,sub_category
"The AVSEC Programme continued to develop with the rollout of the new AVSEC Standard Operating Procedures (SOPs) in May 2023 across all UNHAS operations as required by the UNAVSTADs, WFP Air Transport Manual, the Aviation Policy and other rules and regulations.",0,0,1,UNHAS,
Grâce à notre solution de télémédecine les patients peuvent consulter des médecins à distance ce qui réduit les délais d'attente et améliore l'accès aux soins de santé,0,1,0,Synthetic,Accès_à_la_santé
Grâce à notre solution de cryptage de données nos clients peuvent être certains que leurs opérations respectent les réglementations en vigueur ce qui leur évite toute amende ou poursuite judiciaire liée à la nonconformité,0,0,1,Synthetic,Cryptage_de_données
Photo page 59: WFP/Patrick Mwangi,0,0,0,UNHAS,
En utilisant notre solution les résidents pourront promouvoir leurs propres événements locaux favorisant ainsi une plus grande participation et contribution à la vie communautaire,0,1,0,Synthetic,Offre_evenementielle
Sudan 4.5M Mali 1.7M Niger 0.9M Mozambique 0.8M,0,0,0,UNHAS,
En regroupant les données de performance des différents canaux de vente il est plus facile d'identifier les canaux les plus rentables et d'allouer les ressources de manière plus efficace ce qui peut augmenter le retour sur investissement marketing,1,0,0,Synthetic,Centralisation_des_données
Un fournisseur de services financiers a utilisé la solution d'anticipation des risques pour identifier les tendances du marché et anticiper les fluctuations des taux de change ce qui a permis de réduire les pertes de change et d'optimiser les rendements,1,0,0,Synthetic,Anticipation_des_risques
La modernisation de nos systèmes de sécurité nous permettra de réduire les risques d'incident ou de vol ce qui protégera nos actifs et nos employés,1,0,0,Synthetic,Modérnisation_des_installations
En utilisant notre solution les résidents locaux pourront accéder à des informations sur les événements culturels sportifs et communautaires à venir dans leur région ce qui enrichira leur vie sociale et culturelle,0,1,0,Synthetic,Marketing_territorial
"The GHO estimated that 7.9 million people were in need of humanitarian assistance in 2023, of which 4.4 million were considered in need of targeted assistance.",0,0,0,UNHAS,
En investissant dans une assurance adéquate notre entreprise peut se protéger contre les risques liés aux catastrophes naturelles ce qui nous permet de minimiser les pertes potentielles et de maintenir notre rentabilité,1,0,0,Synthetic,Maitrise_des_risques
This overall success can be   attributed to the prioritisation of safety and security of flights.,0,0,1,UNHAS,
En adoptant nos solutions vous bénéficierez d'une tranquillité d'esprit quant au respect des obligations légales ce qui vous permettra de vous concentrer sur votre activité principale,0,0,1,Synthetic,Remise_en_conformité_des_infrastructures_obsolètes
En modernisant nos installations nous pourrons répondre aux normes et réglementations en vigueur ce qui nous évitera des amendes et des frais liés à la nonconformité,1,0,0,Synthetic,Modérnisation_des_installations
"In 2023, the PSS and PASS surveys showed an overall satisfaction rate of 99 per cent and 98 per cent    respectively.",0,1,0,UNHAS,
Grâce à nos innovations technologiques nous pouvons garantir à nos clients une réduction mesurable des émissions de polluants ce qui les aidera à respecter les obligations légales en la matière,0,0,1,Synthetic,Respect_des_règles_sur_les_emissions_des_polluants
Somalia 0.4M Ethiopia 0.3M,0,0,0,UNHAS,
UNHAS | Annual Review 2023 16 Date | Brochure title,0,0,0,UNHAS,
"As a part of this process, the WFP Aviation Service continues to work with its contracted air carriers to develop and implement series of operational opportunities to reduce fuel burn and emissions.",1,1,0,UNHAS,
Notre solution de Lumonisité sur l'espace public aidera à renforcer le sentiment de communauté en offrant un environnement lumineux et accueillant pour tous les résidents quel que soit leur âge ou leur origine,0,1,0,Synthetic,Lumonisité_sur_l'espace_public
An EU Humanitarian Aid Flight rotary-wing aircraft has been active in Burkina Faso since November 2022.,0,0,0,UNHAS,
Nous offrons un support complet pour vous aider à comprendre et à appliquer les normes internationales facilitant ainsi votre conformité aux exigences légales et réglementaires,0,0,1,Synthetic,Respect_des_normes_internationales
En choisissant nos produits vous vous assurez de respecter les exigences légales en matière de protection de la vie privée et de la confidentialité des données évitant ainsi tout risque de violation des lois sur la protection des données,0,0,1,Synthetic,Obligation_réglementaire
Etienne Lamah Head of Office Nyunzu (DRC)    Concern Worldwide,0,0,0,UNHAS,
En automatisant nos campagnes de marketing par email nous avons constaté une augmentation de 30 % du taux de conversion ce qui a directement impacté notre retour sur investissement publicitaire,1,0,0,Synthetic,Automatisation_des_tâches_
En réduisant le temps nécessaire pour résoudre les problèmes de production nous avons pu minimiser les interruptions et maximiser notre capacité de production ce qui a eu un impact direct sur nos profits,1,0,0,Synthetic,Réduction_de_temps_de_cycle
UNHAS | Annual Review 2023 14 Date | Brochure title,0,0,0,UNHAS,
"The humanitarian community in the country has continued to express their appreciation for the services and have requested the continuation of the operation, which registered a 97 per cent user satisfaction rate according to the PSS and PASS sur- veys carried out in December 2023.",0,1,0,UNHAS,
Yemen Humanitarian Response Plan 2023 (January 2023) [EN/AR] - Yemen | ReliefWeb.,0,0,0,UNHAS,
"In May, 2,172 passengers were transported, breaking the record of most     passengers transported in one month since the   beginning of operations in 2008.",0,1,0,UNHAS,
Notre technologie avancée garantit le respect des normes de sécurité et de protection individuelle répondant ainsi aux obligations réglementaires de votre secteur d'activité,0,0,1,Synthetic,Protection_Individuelle
Les jeunes de la communauté pourront s'impliquer dans des activités de plein air grâce à notre équipement de loisir encourageant ainsi un mode de vie sain et actif dès le plus jeune âge,0,1,0,Synthetic,Equipement_de_loisir
En utilisant ce produit notre entreprise a pu réduire sa consommation d'énergie de 20 % ce qui a eu un impact positif sur nos coûts opérationnels,1,0,0,Synthetic,économie_d'énergie
"UNHAS teams are often the first on the  scene, providing passenger and cargo transport, facilitating medical and security evacuations when the need arises, offering solutions to expedite assessment missions, and more.",1,1,1,UNHAS,
Cessna Grand Caravan x1 Dornier 228 x1 Embraer ERJ 135 LR x5 LET L-410 Turbolet,0,0,0,UNHAS,
"This meant the reduction or closure of many humanitarian projects in the country, while telecommuting was developed.",0,0,0,UNHAS,
Nos produits intègrent des fonctionnalités de pseudonymisation et d'anonymisation des données pour garantir le respect des principes de minimisation des données et de protection de la vie privée,0,0,1,Synthetic,Protection_de_données
"In addition, needs assessment flights were coordinated in Maputo to support flood response efforts in collaboration with INGC.",0,0,0,UNHAS,
"Haiti flights  performed 48,000 mt of light humanitarian cargo transported",0,0,0,UNHAS,
Grâce à notre solution les citoyens peuvent proposer des idées d'amélioration pour leur quartier et voter pour les projets qui leur tiennent à cœur favorisant ainsi l'implication citoyenne,0,1,0,Synthetic,Implication_citoyenne
En participant à des projets communautaires sur notre plateforme les résidents peuvent mettre en avant leurs compétences et leurs intérêts ce qui les aidera à gagner en notoriété au sein de la communauté,0,1,0,Synthetic,Notorité
En utilisant notre plateforme de santé mobile les résidents peuvent prendre rendezvous chez le médecin accéder à leur dossier médical et recevoir des rappels pour leurs rendezvous ce qui facilite la gestion de leur santé au quotidien,0,1,0,Synthetic,Accès_à_la_santé
"It is here that  airdrops come in, as the best and last resort, to deliver food directly into a crisis area and prevent catastrophe.",1,1,1,UNHAS,
En adoptant cette solution les entreprises peuvent suivre et analyser les indicateurs clés de performance identifiant ainsi les domaines où des améliorations peuvent être apportées pour augmenter la productivité,1,0,0,Synthetic,Gain_de_productivité
"Air transport was an integral part of WFP’s logistics by the 1980s, and by the 1990s many United Nations agencies were using air support to respond to a major surge in global humanitarian crises.",0,0,0,UNHAS,
Centraliser les données des fournisseurs permet de négocier de meilleurs tarifs et conditions ce qui peut entraîner des économies significatives sur les achats,1,0,0,Synthetic,Centralisation_des_données
There are several steps in the process to establishing a UNHAS operation.,0,0,0,UNHAS,
En favorisant la création d'espaces de coworking et d'entrepreneuriat notre solution pourra attirer de jeunes entrepreneurs et professionnels talentueux participant ainsi au dynamisme économique et social de la région,0,1,0,Synthetic,Attractivité_territoriale
The aircraft has a cruise speed of 360 knots (667 km/h) and includes the Active Noise and Vibration Suppression system.,0,0,0,UNHAS,
"BELGIUM 1,078,046 destinations reached (40 regular | 19 ad hoc)",0,0,0,UNHAS,
En utilisant notre produit les citoyens pourront facilement trouver des commerces offrant des produits locaux et artisanaux ce qui contribuera à promouvoir l'économie locale,0,1,0,Synthetic,Accès_aux_commerces
Créer des groupes de volontaires pour des actions caritatives locales afin d'encourager un esprit de solidarité et d'entraide,0,1,0,Synthetic,Animation_sociale
"Together, we navigate not just airspace, delivering hope where it’s needed most.",0,1,0,UNHAS,
"The aviation sector remains     underdeveloped, with insufficient  in infrastructure and capacity and a history of poor safety records among commercial carriers.",0,0,1,UNHAS,
Nous sommes en conformité avec les exigences légales en matière de conservation des données vous permettant ainsi de respecter vos obligations légales sans souci,0,0,1,Synthetic,Sécurité_des_données
En utilisant des outils de mise en conformité des données nous avons réussi à identifier et à combler les lacunes de nos données ce qui a amélioré notre prise de décision et notre agilité commerciale,1,0,0,Synthetic,Mise_en_conformité_de_données
En choisissant nos solutions vous pouvez être sûr que vous respectez toutes les obligations légales applicables ce qui renforcera la confiance de vos clients et partenaires commerciaux,0,0,1,Synthetic,Obligation
A new call for submission is being launched in the first quarter of 2024 to allocate funds for to field operations.,0,0,0,UNHAS,
Grâce à notre plateforme de covoiturage et de partage de trajets les résidents peuvent se connecter pour réduire leur empreinte carbone économiser de l'argent et tisser des liens sociaux tout en se déplaçant dans leur quartier,0,1,0,Synthetic,Renforcement_des_liens_communautaire
How do I book a UNHAS flight,0,0,0,UNHAS,
Nos produits intègrent des fonctionnalités de pseudonymisation et d'anonymisation des données permettant de respecter les principes de minimisation et de limitation de la collecte des données personnelles,0,0,1,Synthetic,Respect_de_la_vie_privée_au_sens_légal
Fuel shortage and quality concerns were effectively addressed through strategic contracts with two reliable fuel suppliers.,1,0,1,UNHAS,
Nos produits sont munis de labels de conformité clairement visibles démontrant notre engagement envers le respect des normes européennes,0,0,1,Synthetic,Respect_des_normes_européean
"Extreme violence perpetrated by armed gangs against the Haitian population has continued to spread across the country, reaching distant rural areas as the state’s presence has continued to erode.",0,0,1,UNHAS,
The allocations to field operations are guided by a set of SOPs and are done on a quarterly basis.,0,0,0,UNHAS,
Une entreprise de télécommunications a implémenté cette solution pour optimiser l'utilisation de la bande passante ce qui a permis d'améliorer la qualité du service tout en réduisant les coûts,1,0,0,Synthetic,Optimisation_des_ressources_
En facilitant l'accès aux services de santé et de bienêtre notre solution contribue à améliorer la qualité de vie des résidents en particulier des groupes défavorisés,0,1,0,Synthetic,Inclusion_sociale
Nous avons mis en place des outils de suivi et d'analyse des données liées à la santé au travail permettant à nos clients de produire des rapports conformes aux exigences de la réglementation en vigueur,0,0,1,Synthetic,Respects_des_règles_de_santé_au_travail
"A twin-engine short-range transport aircraft, capable of landing on short and unpaved runways and operating under extreme weather conditions.",0,0,0,UNHAS,
En utilisant cette solution notre équipe de gestion des stocks a pu réduire les niveaux de stock excédentaire de 30% tout en assurant une disponibilité constante des produits pour nos clients,1,0,0,Synthetic,Augmentation_de_performance
DRC 4.3M Nigeria 1.5M Niger 0.5M Mali 0.5M Sudan 0.4M Cameroon 0.4M,0,0,0,UNHAS,
En utilisant notre solution les résidents pourront localiser des espaces de travail partagés des centres d'affaires ou des bureaux accessibles favorisant ainsi leur intégration professionnelle et leur participation à la vie économique de la communauté,0,1,0,Synthetic,Accessibilité
"The increase in resources compared with 2022 allowed for the deployment of a second aircraft in Kinshasa, making the service more reliable in linking the west and east provinces of the country.",1,0,0,UNHAS,
Un fabricant de produits chimiques a adopté des processus de production plus écologiques et économes en énergie ce qui a réduit ses coûts de fonctionnement et amélioré son image de marque,1,0,0,Synthetic,amélioration_de_l'efficacité_énergitique
L'utilisation de thermostats intelligents dans un immeuble de bureaux peut aider à réduire les coûts de chauffage et de climatisation offrant ainsi un retour sur investissement en réduisant la consommation d'énergie,1,0,0,Synthetic,économie_des_consommations
Nos produits offrent une documentation détaillée et des rapports personnalisables pour démontrer la conformité aux règlementations en vigueur en matière de Maintien en conditions opérationnelles,0,0,1,Synthetic,Maintien_en_conditions_opérationnelles
Mettre en place des navettes entre les quartiers et les zones commerciales permettrait aux résidents de faire leurs courses plus facilement,0,1,0,Synthetic,Offre_de_mobilité
En proposant des solutions de transport à la demande pour les personnes âgées ou à mobilité réduite notre entreprise favorise l'inclusion et l'accessibilité pour tous les citoyens,0,1,0,Synthetic,Simplification_de_la_mobilité
"To ensure continuous and safe   operations, deconfliction efforts were intensified, including the development of Deconfliction Standard Operating  Procedures in North Kivu.",0,0,1,UNHAS,
"In addition, dedicated  safety trainings were  conducted for air    operators, the civil aviation  authority, staff and airfield focal points.",0,0,1,UNHAS,
En optant pour ce produit les entreprises peuvent rationaliser leurs processus de gestion des infrastructures ce qui se traduit par des économies de coûts et une amélioration du retour sur investissement,1,0,0,Synthetic,Optimiser_les_infrastructures
Grâce à la collecte automatisée des données une entreprise de télécommunications peut suivre la consommation des données de ses clients ce qui lui permet de proposer des forfaits personnalisés et d'augmenter ses revenus,1,0,0,Synthetic,Collecte_automatisée_des_données
L'installation de l'éclairage à LED dans notre entrepôt a entraîné une réduction de 30 % de notre consommation d'énergie ce qui a permis un retour sur investissement en moins de 18 mois,1,0,0,Synthetic,économie_d'energie
En utilisant notre produit les habitants pourront bénéficier de réductions spéciales dans les commerces de proximité ce qui favorisera leur accès à des produits de qualité à des prix abordables,0,1,0,Synthetic,Accès_aux_commerces
Nous avons mis en place des processus de gestion de la conformité rigoureux pour nous assurer que nos produits répondent aux exigences légales et réglementaires ce qui vous donne une tranquillité d'esprit supplémentaire,0,0,1,Synthetic,Respect_des_normes_internationales
Nos produits sont régulièrement testés et certifiés par des organismes internationaux indépendants ce qui atteste de leur conformité aux normes en vigueur,0,0,1,Synthetic,Respect_des_normes_internationales
Ce produit a permis à une entreprise de production de biens de consommation de mieux gérer ses stocks et ses approvisionnements réduisant ainsi les coûts liés au stockage et à la gestion des inventaires,1,0,0,Synthetic,Optimiser_la_production
Nous offrons des fonctionnalités de suivi des conditions de travail et de sécurité au travail permettant de documenter et de respecter les normes de sécurité et de santé au travail,0,0,1,Synthetic,Respect_du_droit_de_travail
Nos produits offrent une traçabilité complète des actions entreprises pour se conformer à l'Obligation légale permettant aux entreprises de prouver leur bonne foi et leur engagement envers le respect de la législation en cas de contrôle ou de litige,0,0,1,Synthetic,Obligation_légale
Notre solution permet aux citoyens de signaler les problèmes de sécurité d'environnement ou d'urbanisme à leurs autorités locales facilitant ainsi la résolution rapide de problèmes et renforçant le sentiment de responsabilité collective,0,1,0,Synthetic,Engagement_communautaire
Notre solution encourage les commerces locaux à diversifier leur offre et à promouvoir des produits locaux ce qui renforce l'économie locale et favorise une plus grande variété d'options pour les résidents,0,1,0,Synthetic,Dynamisation_de_cœur_de_ville
Un fabricant d'automobiles utilise la gestion de l'obsolescence pour s'assurer que ses modèles de voitures restent à jour et conformes aux réglementations en constante évolution ce qui lui permet de maintenir sa part de marché et d'augmenter sa rentabilité,1,0,0,Synthetic,Gestion_de_l'obsolescence
Nous avons intégré dans nos produits des fonctionnalités spécifiques permettant de répondre aux exigences légales en matière de transparence et d'équité dans les marchés publics,0,0,1,Synthetic,Respect_des_codes_de_marchés_publiques
Nous nous engageons à accompagner nos clients dans la mise en place de nos solutions en leur fournissant les conseils et les informations nécessaires pour s'assurer de leur conformité aux exigences légales en matière de sécurité,0,0,1,Synthetic,Respect_des_règles_de_sécurité
En utilisant la valorisation des données une entreprise de commerce de détail peut optimiser son stock en identifiant les tendances d'achat et en ajustant ses commandes en conséquence ce qui se traduit par une réduction des coûts de stockage inutiles,1,0,0,Synthetic,Valorisation_des_données
"UNHAS has been operating in Syria since 2020 to cover vast distances and offer viable transport options to aid workers in the face of localised insecurity, making connectivity complex, time- consuming, and dangerous.",0,0,0,UNHAS,
"UNHAS serves the entire humanitarian community – not just United Nations   agencies, funds and programmes.",0,0,0,UNHAS,
UNHAS has been operating in the country since 2020 to provide safe and effective air connections between Damascus and Qamishli in the   northeast.,0,0,1,UNHAS,
Notre service de livraison de repas sains et équilibrés offre aux citoyens la possibilité de se concentrer sur leur bienêtre en ayant un accès facile à une alimentation nourrissante et de qualité,0,1,0,Synthetic,Sérenité
"In this complex scenario of access challenges that greatly impact   humanitarian response and   activities in country, UNHAS    operations have become essential for reaching vulnerable populations and for supporting humanitarian activities in the deep field all over the country.",0,1,0,UNHAS,
"These flights transported 45,253 passengers via fixed-wing, connecting Abuja, Maiduguri and Yola, along with rotary-wing to 11 deep-field locations.",0,0,0,UNHAS,
"The digital solution is customisable to meet the specific needs of each UNHAS operation and is accessible on commonly used devices, such as desktop computers, laptops, tablets, and mobile phones.",1,0,0,UNHAS,
"This collaboration ensures access to critical information on fuel production pathways, usage limitations, environmental benefits and policy perspectives on the use and development of sustainable aviation fuels.",1,1,0,UNHAS,
Notre plateforme permet aux citoyens locaux de découvrir et de soutenir les initiatives locales ce qui renforcera leur réputation au sein de la communauté,0,1,0,Synthetic,Notorité
"Special regional flights between Niamey and Ouagadougou continued from August to mid- October, facilitating ongoing humanitarian movements.",1,0,0,UNHAS,
Nous proposons des formations et des conseils personnalisés pour accompagner nos clients dans la mise en place et le suivi de leurs obligations légales en matière de Respect des normes ATEX,0,0,1,Synthetic,Respect_des_normes_ATEX
En choisissant nos solutions vous faites le choix de vous conformer aux dispositions légales applicables en matière de sécurité des données réduisant ainsi votre exposition aux risques juridiques et financiers,0,0,1,Synthetic,Sécurité_des_données
"analyses and establishes aviation security risks in all field operations, provides assessments, mitigates existing risks, reducing exposure to security-related incidents, and provides specialised support enabling immediate access to populations in need.",1,0,1,UNHAS,
Nos solutions offrent une traçabilité complète des données ce qui permet à nos clients de répondre aux exigences de conservation des données imposées par la loi,0,0,1,Synthetic,Contraintes_réglementaire
Scan the QR code or click here,0,0,0,UNHAS,
Notre solution facilite l'accès à des services de soutien tels que les garderies et les transports en commun ce qui permet aux résidents de concilier plus facilement leur vie professionnelle et leur vie personnelle augmentant ainsi leur employabilité,0,1,0,Synthetic,Réduction_du_chommage
hoc passenger and cargo flights.,0,0,0,UNHAS,
En utilisant cette solution nous avons pu réduire nos émissions de carbone ce qui nous a permis de renforcer notre image de marque et d'attirer de nouveaux clients sensibles aux enjeux environnementaux,1,0,0,Synthetic,économie_d'énergie
En simplifiant l'accès et la gestion des données pour les équipes de vente et de service client la gouvernance des données peut permettre aux entreprises d'améliorer la satisfaction client et la rétention ce qui constitue un important retour sur investissement à long terme,1,0,0,Synthetic,Gouvernance_de_la_données
Nos solutions incluent des fonctionnalités de gestion des risques qui contribueront à minimiser les incidents et les accidents liés à un défaut de maintenance des équipements vous mettant ainsi en conformité avec les lois en vigueur,0,0,1,Synthetic,Maintien_en_conditions_opérationnelles_des_équipement
La standardisation des données comptables peut permettre à une entreprise de simplifier ses processus financiers réduire les risques d'erreurs et améliorer la rentabilité grâce à une gestion plus efficace,1,0,0,Synthetic,Standardisation_des_données
Yemen 3.2M Syria 2.0M Chad 1.5M Afghanistan 1.3M Sudan 1.2M Nigeria 1.1M,0,0,0,UNHAS,
"In 2024, an estimated 6.3 million people are projected to be in need of humanitarian assistance in Burkina Faso, versus 3.8 million in 2023.",0,0,0,UNHAS,
Une entreprise de logistique a adopté des technologies de suivi des actifs pour ses équipements de manutention ce qui a permis de minimiser les pertes d'inventaire liées à des équipements manquants et d'assurer une disponibilité optimale de ses ressources augmentant ainsi son efficacité opérationnelle,1,0,0,Synthetic,Disponibilité_des_equipements
IG US World Food Program United States,0,0,0,UNHAS,
"Further, it is critical for maintaining and strengthening an emergency preparedness and response system by enhancing aviation emergency response capabilities, designing response scenarios and serving as a first wave deployment during sudden on set of emergencies.",1,0,1,UNHAS,
Grâce à l'installation de parcs solaires et éoliens dans la région les citoyens locaux bénéficieront d'une source d'énergie propre et renouvelable contribuant ainsi à la préservation de l'environnement,0,1,0,Synthetic,Valorisation_de_la_qualité_environnementale
Grâce à nos solutions les clients peuvent facilement gérer les audits de conformité et garantir la traçabilité des opérations liées au Maintien en conditions opérationnelles,0,0,1,Synthetic,Maintien_en_conditions_opérationnelles
En utilisant ce produit une entreprise de services financiers a amélioré la fonctionnalité de gestion des risques ce qui a conduit à des décisions plus éclairées et à une réduction des pertes générant ainsi un retour sur investissement significatif,1,0,0,Synthetic,Amélioration_des_fonctionnalité
UNHAS Syrian Arab Republic .,0,0,0,UNHAS,
Photo page 60: WFP/Benoît Lognoné,0,0,0,UNHAS,
