sentence,roi,notoriete,obligation,source,sub_category
"In Burkina Faso,  widespread insecurity resulted in deteriorated access and required the deployment of seven rotary-wing aircraft to reach people in need.",0,0,1,UNHAS,
L'adoption de pratiques de gestion des déchets et de recyclage dans un lieu de travail peut réduire les coûts liés à l'élimination des déchets offrant ainsi un retour sur investissement grâce à des économies sur les services de gestion des déchets,1,0,0,Synthetic,économie_des_consommations
Photo page 51: WFP/Med Lemine Rajel,0,0,0,UNHAS,
En utilisant cette solution une entreprise de marketing digital a pu augmenter ses revenus publicitaires de 30 % ce qui a directement impacté ses résultats d'exploitation,1,0,0,Synthetic,Résultats_d'exploitations
UNHAS operates an aircraft from Mopti and offers air transport to some hard-to-reach  locations.,0,0,0,UNHAS,
Guinea | Gratien Kasongo | gratien.kasongo@wfp.org,0,0,0,UNHAS,
Grâce à une meilleure optimisation des flux de gestion de projet nous avons pu respecter les délais plus facilement réduisant ainsi les coûts liés aux retards et aux dépassements de budget,1,0,0,Synthetic,Optimisation_des_flux
L'intégration rapide et facile de cette solution de gestion des stocks a permis à notre entreprise de réduire le temps nécessaire pour suivre et gérer nos stocks ce qui a entraîné des économies de temps et d'argent significatives,1,0,0,Synthetic,Facilité_et_rapidité_de_déploiment
Les résidents pourront voter et donner leur avis sur les projets locaux ce qui les rendra plus investis dans la vie de leur quartier,0,1,0,Synthetic,Participation_citoyenne
"The Airbus Helicopters H225 (formerly Eurocopter EC225) is a twin-engine,   long-range passenger transport helicopter developed by Eurocopter as the next generation of the civilian Super Puma family to carry up to 24 passengers.",0,0,0,UNHAS,
En proposant des programmes de réduction du stress et de la solitude notre entreprise contribue à améliorer la santé mentale des citoyens locaux en offrant des outils pour faire face aux défis de la vie quotidienne,0,1,0,Synthetic,Cadre_de_vie
En utilisant notre solution les habitants pourront accéder à des ressources éducatives en ligne pour améliorer leurs compétences et leur employabilité ce qui favorise l'épanouissement personnel,0,1,0,Synthetic,Bienveillance
Grâce à notre plateforme de partage de compétences les résidents peuvent offrir leurs connaissances et leur expertise à leurs voisins favorisant ainsi les interactions sociales et la solidarité au sein de la communauté,0,1,0,Synthetic,Lien_sociale
Une entreprise de logistique a amélioré ses calendriers de livraison grâce à cette solution ce qui a réduit ses coûts d'exploitation de 12 % et a augmenté ses résultats d'exploitation,1,0,0,Synthetic,Résultats_d'exploitations
Grâce à nos produits et solutions nos clients disposent d'un soutien continu pour la mise en place de processus et de procédures conformes aux exigences légales liées à l'Inspection réglementaire,0,0,1,Synthetic,Inspection_reglementaire
"In August 2023, a special regional operation was activated, connecting  Niamey and Ouagadougou (Burkina Faso) to allow for the swift movement of humanitarian personnel in and out of Niger in the absence of reliable   commercial operators.",1,1,0,UNHAS,
En utilisant les données de localisation des clients les commerçants peuvent optimiser leurs opérations en ouvrant de nouvelles succursales ou en ajustant les horaires d'ouverture pour mieux répondre à la demande ce qui entraîne une augmentation des revenus,1,0,0,Synthetic,Monétisation_de_la_donnée
Democratic Republic of the Congo *Syrian AR,0,0,0,UNHAS,
Nous avons conçu nos produits pour répondre aux exigences de sûreté visàvis de l'environnement vous procurant ainsi une protection juridique en cas d'accidents ou de dommages environnementaux,0,0,1,Synthetic,Respect_de_l'environnement_au_niveau_légal
En choisissant nos produits nos clients peuvent être sûrs de respecter toutes les exigences réglementaires en matière de protection de la santé de leurs employés sur le lieu de travail,0,0,1,Synthetic,Respects_des_règles_de_santé_au_travail
Niger 0.8M Nigeria 0.6M Haiti 0.5M South Sudan 0.5M Madagascar 0.1M,0,0,0,UNHAS,
"In 2023, the PSS and PASS surveys showed an overall satisfaction rate of 99 per cent and 94 per cent    respectively.",0,1,0,UNHAS,
Funding requirements to sustain the operation until the end of 2024 .,0,0,0,UNHAS,
Les habitants peuvent utiliser notre plateforme pour échanger des compétences et des services entre voisins favorisant ainsi l'entraide et la coopération au sein de la communauté,0,1,0,Synthetic,Implication_citoyenne
Un opérateur télécom peut utiliser la modélisation des prix pour proposer des forfaits personnalisés en fonction de l'utilisation des clients ce qui peut augmenter sa rétention de clients et ses revenus,1,0,0,Synthetic,Modélisation_des_pricings
Photo page 35: WFP/Evelyn Fey,0,0,0,UNHAS,
Photo 2 page 79: WFP/Jasmeen Sihra,0,0,0,UNHAS,
Nous offrons des formations et des ressources pour aider nos clients à comprendre et à respecter les obligations légales liées à la protection des infrastructures et à mettre en œuvre efficacement nos solutions dans ce contexte,0,0,1,Synthetic,Protection_des_infrastructures
Nous offrons des formations et des ressources pour aider nos clients à comprendre et à respecter les obligations légales liées aux droits de l'homme les aidant ainsi à éviter les risques de nonconformité,0,0,1,Synthetic,Respects_du_droit_de_l'homme_au_sens_légale
Photo page 28: WFP/Cheick Omar Bandaogo,0,0,0,UNHAS,
Notre solution de partage de jardins communautaires encourage les citoyens à cultiver et partager des produits locaux favorisant ainsi la cohésion sociale et le soutien aux agriculteurs locaux,0,1,0,Synthetic,adhésion_citoyenne
"UNHAS remains steadfast, delivering essential aid to those in need.",0,1,0,UNHAS,
En utilisant cette solution axée sur l'engagement de résultats une entreprise a pu augmenter de 25% ses ventes en ligne au cours de la première année,1,0,0,Synthetic,Engagement_de_résultats
Une entreprise de vente au détail a adopté le produit pour automatiser la collecte des données sur les stocks ce qui a permis de réduire les ruptures de stock et d'optimiser la gestion des approvisionnements,1,0,0,Synthetic,Réduction_des_coûts_liées_à_la_collecte_manuelles_des_données
"Airside Driving, Induction to AVSEC Culture, Airport Security and Screening – Handheld Metal Detectors (HHMDs), Incident Handling, Airport Emergency Response Plan (A",0,0,0,UNHAS,
"The operation has also served Aleppo (located in the north- west) on a regular basis since 2021, and is continuing to advocate for the launch of new destinations as  needed.",0,0,0,UNHAS,
The operation also added an additional flight day to its regular schedule for missions to the Kakuma and Dadaab refugee camps.,1,1,0,UNHAS,
Contribution from the Government of Guinea through the International Monetary Fund (IMF).,0,0,0,UNHAS,
The course will increase participants’ awareness and prepare them to actively implement and promote sustainable practices within their roles in WFP aviation.,1,1,0,UNHAS,
Nous avons mis en place des mesures de sécurité avancées pour assurer la confidentialité et l'intégrité des données conformément aux exigences légales en matière de protection des infrastructures,0,0,1,Synthetic,Protection_des_infrastructures
"According to the  Humanitarian Needs Overview 2023, 15.3 million people were in need this past year – 69 per cent of the total population of the country19.",0,0,0,UNHAS,
En investissant dans nos produits vous investissez dans la conformité et le respect des obligations légales liées à la sécurité au travail vous évitant ainsi des frais et des sanctions en cas de nonconformité,0,0,1,Synthetic,Sécurité_au_travail
Nos produits sont conçus pour minimiser les risques d'accidents du travail vous aidant ainsi à respecter vos obligations en termes de prévention des risques professionnels,0,0,1,Synthetic,Sécurité_au_travail
Un logiciel de sécurité informatique basé sur un modèle de paiement que si nécessaire a permis à une entreprise de renforcer sa sécurité tout en maîtrisant ses coûts opérationnels,1,0,0,Synthetic,Paiement_que_si_nécessaire_(as_a_service)
Nos solutions intègrent des mécanismes de gestion des incidents de sécurité des données afin de vous aider à répondre aux exigences de notification des violations de données énoncées dans les lois sur la confidentialité,0,0,1,Synthetic,Protection_de_la_confidentialité
"In October and November 2023,   the operation supported the   voluntary repatriation of Congolese refugees from Angola to DRC,  transporting a total of 525 refugees.",0,0,0,UNHAS,
Nous avons intégré des fonctionnalités spécifiques dans nos solutions pour vous aider à respecter les réglementations relatives à la protection des données personnelles et à la confidentialité,0,0,1,Synthetic,Respect_de_l'éthique_au_sens_légal
Photo 3 page 18: WFP/Nejmeddine Halfaoui,0,0,0,UNHAS,
Their partnership and collaboration amplifies our impact – a true embodiment of Sustainable Development Goal number 17 – partnership for the goals.,1,1,0,UNHAS,
En choisissant nos produits vous pouvez être sûr de respecter les obligations légales liées à Obligation ce qui vous permet de vous concentrer sur vos activités commerciales principales en toute tranquillité d'esprit,0,0,1,Synthetic,Obligation
Chad faces the consequences of the recent crisis in Sudan with a dramatic increase of the number of refugees close to the Sudanese border.,0,0,0,UNHAS,
En soutenant les initiatives culturelles et artistiques locales notre entreprise favorise les échanges et les interactions entre les habitants renforçant ainsi le tissu social de la communauté,0,1,0,Synthetic,Lien_sociale
Nous offrons un support complet pour l'audit et la documentation facilitant ainsi la démonstration de conformité aux autorités réglementaires et aux organismes de certification,0,0,1,Synthetic,Sécurité
En facilitant l'accès à des offres d'emploi locales et à des opportunités de développement de carrière notre solution peut encourager les résidents à rester ancrés dans la communauté et à contribuer à son dynamisme économique,0,1,0,Synthetic,Emploi
La mutualisation des espaces de bureau et des infrastructures de support nous permet de réduire nos charges locatives et de maximiser notre retour sur investissement,1,0,0,Synthetic,Mutualisation_
UNHAS | Annual Review 2023 56 Date | Brochure title,0,0,0,UNHAS,
Nous offrons une solution de cryptage avancée qui assure la sécurité des données personnelles à chaque étape du processus répondant ainsi aux exigences de protection des données,0,0,1,Synthetic,Protection_des_personnes
En mettant en place des programmes de volontariat nous offrons aux habitants la possibilité de s'engager dans des activités bénévoles qui enrichissent leur vie et contribuent à la collectivité,0,1,0,Synthetic,Amélioration_de_la_qualité_de_vie
Grâce à la digitalisation de nos processus de vente nous avons pu offrir une expérience client plus fluide et augmenter nos ventes en ligne,1,0,0,Synthetic,Digitalisation_
Nos solutions offrent à nos clients la tranquillité d'esprit en termes de conformité légale grâce à des technologies avancées de réduction du bruit,0,0,1,Synthetic,Respect_de_la_réglementation_sur_les_nuisances_sonorres
Notre entreprise propose des événements et des activités pour les résidents afin de favoriser les échanges culturels et artistiques offrant ainsi des opportunités d'apprentissage et de découverte,0,1,0,Synthetic,Expertises
Notre système de gestion des déchets intelligents permettra de réduire le temps d'attente pour les ramassages de déchets améliorant ainsi la qualité de vie des résidents,0,1,0,Synthetic,Propreté
"Concurrently, efforts were made to strengthen national civil aviation capacity.",0,0,0,UNHAS,
Grâce à notre produit les résidents pourront avoir accès à des programmes éducatifs et de formation professionnelle améliorant ainsi leurs opportunités d'emploi et leur qualité de vie,0,1,0,Synthetic,Services_aux_usagers
Nous offrons des outils de gestion des droits d'accès et de contrôle des données conformes aux dispositions légales en matière de protection de la vie privée et de sécurité des informations,0,0,1,Synthetic,Respect_de_la_vie_privée_au_sens_légal
Un cabinet d'avocats a réussi à respecter des délais stricts pour la soumission de documents légaux en utilisant la solution ce qui lui a permis d'éviter des litiges coûteux pour nonrespect des délais,1,0,0,Synthetic,Respect_des_délais_
Grâce à notre approche proactive en matière de conformité nos produits et solutions permettent à nos clients d'éviter les amendes et les sanctions liées au nonrespect des obligations réglementaires en matière d'Inspection réglementaire,0,0,1,Synthetic,Inspection_reglementaire
Grâce à la dématérialisation de nos rapports financiers nous avons pu accélérer la prise de décision réduire les délais de clôture et améliorer la transparence de nos opérations ce qui a renforcé la confiance des investisseurs et la valorisation de notre entreprise,1,0,0,Synthetic,Dématérialisation
This demonstrates the relevance of the service in a context where   humanitarian needs have constantly been growing and access to vulnerable people paramount—all these amid challenges such as the current global  increase in fuel prices and other supply chain   constraints.,0,0,0,UNHAS,
En encourageant le commerce local et en mettant en avant les petites entreprises notre solution contribue à dynamiser l'économie locale créant ainsi de nouvelles opportunités économiques pour les résidents,0,1,0,Synthetic,Augmentation_de_pouvoir_d'achat_
Un fabricant de produits électroniques signe un contrat de performances avec un fournisseur de technologie de fabrication avancée garantissant une augmentation de 30 % de la production ce qui lui permet d'optimiser ses opérations et d'augmenter sa rentabilité,1,0,0,Synthetic,Contrat_de_performances
Grâce à des initiatives de santé et de bienêtre notre solution permet aux résidents de réduire leurs dépenses de santé et de mieux gérer leurs besoins médicaux leur laissant ainsi plus d'argent disponible pour d'autres aspects de leur vie,0,1,0,Synthetic,Augmentation_de_pouvoir_d'achat_
The report and associated recommendations are    presented to the requesting party (the HC or RC) for their endorsement before the UNHAS service is established.,0,0,0,UNHAS,
En optimisant leur infrastructure de stockage les entreprises peuvent réduire les besoins en espace physique et en énergie ce qui se traduit par des économies significatives,1,0,0,Synthetic,Optimisation_de_l'infrastructure
Grâce à notre solution les parents peuvent bénéficier de conseils et de support pour trouver la crèche idéale pour leurs enfants ce qui réduit leur stress et leur anxiété,0,1,0,Synthetic,Accès_aux_crèches
"Amid the turbulence of conflict, I’ve witnessed     the power of humanity soaring above borders,",0,1,0,UNHAS,
Nigeria 2.5M DRC 0.9M Mozambique 0.3M CAR 0.2M,0,0,0,UNHAS,
Les cadres supérieurs peuvent utiliser cette solution pour prendre des décisions financières et stratégiques complexes en se basant sur des modèles et des scénarios prédictifs,1,0,0,Synthetic,Aide_à_la_décision
Contributions breakdown UNHAS earmarked UNHAS Centralized Funding Mechanism,0,0,0,UNHAS,
Notre plateforme de partage de compétences et de services permet aux résidents de trouver des emplois à temps partiel ou des opportunités de travail indépendant augmentant ainsi leurs revenus,0,1,0,Synthetic,Augmentation_de_pouvoir_d'achat_
"UNHAS operates a hub-and-spoke network structure with the main  operational hubs in Bor, Juba and Rumbek counties.",0,0,0,UNHAS,
Grâce à cette solution nous avons pu identifier et résoudre les problèmes de communication au sein de notre équipe ce qui a conduit à une amélioration significative de la productivité et à une diminution des erreurs,1,0,0,Synthetic,Bon_déroulement_des_projets
Créer des clubs de lecture ou des cercles de discussion pour stimuler l'engagement communautaire et l'échange d'idées,0,1,0,Synthetic,Animation_sociale
Grâce à notre solution les familles peuvent trouver des crèches situées à proximité de leur domicile ou de leur lieu de travail ce qui réduit le temps de déplacement et les frais associés,0,1,0,Synthetic,Accès_aux_crèches
En investissant dans un logiciel de maintenance préventive pour nos installations nous avons pu prolonger la durée de vie de nos équipements ce qui a réduit nos coûts d'investissement à long terme de manière significative,1,0,0,Synthetic,Maintenance_préventive
"In addition,  the operation continues to provide  security and safety training to its staff and partner organizations in the field.",0,0,1,UNHAS,
En utilisant notre application de covoiturage les citoyens locaux peuvent réduire leur empreinte carbone en partageant des trajets et en contribuant ainsi à la préservation de l'environnement,0,1,0,Synthetic,adhésion_citoyenne
En offrant des activités communautaires stimulantes et enrichissantes notre solution contribue à rendre la vie des résidents plus attrayante,0,1,0,Synthetic,Attractivité
UNHAS | Annual Review 2023 68 Date | Brochure title 21 UNHAS funding data constantly evolve according to incoming resources.,0,0,0,UNHAS,
Nos solutions offrent des options de consentement claires et transparentes pour les utilisateurs conformément aux exigences légales en matière de collecte et d'utilisation des données personnelles,0,0,1,Synthetic,Respect_de_la_vie_privée_au_sens_légal
Les habitants pourront profiter d'une meilleure connectivité numérique et d'un accès facilité aux services en ligne favorisant ainsi l'inclusion numérique et l'engagement communautaire,0,1,0,Synthetic,Aménagement_urbain
"Five of these medical evacuations were performed using the UNHAS air ambulance, equipped with medical facilities and onboard paramedics, destinations reached (14 regular | 1 ad hoc) providing primary medical support to patients until they reach the health facility.",1,1,1,UNHAS,
Nos technologies de pointe permettent une surveillance en temps réel de l'état de vos équipements vous aidant à prévenir toute défaillance et à respecter ainsi les obligations légales en matière de maintien en conditions opérationnelles,0,0,1,Synthetic,Maintien_en_conditions_opérationnelles_des_équipement
PRIVATE DONOR IG US,0,0,0,UNHAS,
Nous pouvons garantir que nos solutions respectent pleinement les normes environnementales européennes en réduisant l'impact sur l'environnement,0,0,1,Synthetic,Respect_des_normes_européean
"Moreover, no commercial airlines can currently provide safe and reliable air services to enable the humanitarian community to reach     beneficiaries in remote areas of the country.",0,0,1,UNHAS,
Photo page 67: WFP/Alaa Noaman,0,0,0,UNHAS,
"building activities, including for staff, security officers, airport authorities, and government and aviation partners.",0,0,0,UNHAS,
Grâce à notre solution les citoyens pourront bénéficier d'une meilleure accessibilité aux services publics et sociaux ce qui contribuera à rendre la région plus attractive pour les familles et les personnes en situation de précarité,0,1,0,Synthetic,Attractivité_territoriale
"In collaboration with  partners and through donor contribu- tions, the Bor airstrip was     rehabilitated.",0,0,0,UNHAS,
Nos solutions intègrent des fonctionnalités visant à prévenir et à réduire les risques environnementaux ce qui vous place en conformité avec les règlements et lois en vigueur,0,0,1,Synthetic,Respect_de_l'environnement_au_niveau_légal
En choisissant nos produits nos clients évitent tout risque de nonconformité avec les réglementations européennes et les coûts associés,0,0,1,Synthetic,Respect_des_normes_européean
Nous avons mis en place des procédures de gestion des risques conformes aux exigences légales et réglementaires en matière de protection des infrastructures sensibles,0,0,1,Synthetic,Protection_des_infrastructures
En choisissant nos produits et solutions nos clients évitent tout risque de nonconformité et les sanctions associées ce qui leur apporte une tranquillité d'esprit inestimable,0,0,1,Synthetic,Respect_des_normes_ATEX
En proposant un abonnement gratuit à une newsletter contenant des informations utiles et des offres exclusives les entreprises peuvent fidéliser leurs clients et augmenter leur taux de conversion,1,0,0,Synthetic,Gratuité
Une entreprise de fabrication a mis en place la solution pour synchroniser le processus de production ce qui a permis de réduire les temps d'arrêt et d'augmenter la productivité augmentant ainsi les bénéfices,1,0,0,Synthetic,Respect_des_délais_
"Access to Ngaoundéré (Adamawa region) from Yaoundé for example is a one-day drive by road,  Garoua (North region),   is a two-day trip.",0,0,0,UNHAS,
En utilisant notre solution les personnes âgées peuvent accéder à des services de transport adaptés à leurs besoins leur permettant de se déplacer facilement et en toute sécurité pour leurs rendezvous leurs activités sociales ou leurs loisirs,0,1,0,Synthetic,Aide_aux_personnes_agés
Notre plateforme facilite l'organisation de programmes de sensibilisation et d'éducation tels que des ateliers sur la santé des cours de langue ou des formations professionnelles permettant ainsi d'enrichir la vie des citoyens locaux,0,1,0,Synthetic,Engagement_communautaire
"In December, the WFP- managed EU HAF airlifted almost 73 metric tons of cargo, including tents for shelter of displaced   people.",0,1,1,UNHAS,
En investissant dans des techniques de prévention des blessures sur le lieu de travail notre entreprise peut réduire les coûts liés aux accidents du travail et aux arrêts maladie ce qui entraîne des économies et une productivité accrue,1,0,0,Synthetic,Maitrise_des_risques
"Instead, its mission is to provide a safe, effective and efficient alternative for humanitarian workers when conventional aviation   services are impractical or unavailable.",1,1,1,UNHAS,
"Indeed, the Far North region continues to suffer from armed conflict, intercommunity conflicts, poor road infrastructure, especially in the rainy   season, and the impacts  of the climate crisis and harsh weather, impeding humanitarian access in some areas of the region.",0,1,0,UNHAS,
Grâce à notre solution les habitants peuvent trouver des parcs des sentiers de randonnée et d'autres espaces de plein air pour profiter de la nature et rester en forme,0,1,0,Synthetic,Lieu_de_sortie
This work is an opportunity to challenge myself to meet the needs of our users here in South Sudan.,0,0,0,UNHAS,
Grâce à notre application de sécurité communautaire les habitants peuvent signaler rapidement les situations d'urgence et recevoir une assistance immédiate renforçant ainsi le sentiment de sécurité dans leur quartier,0,1,0,Synthetic,Services_aux_habitants
Nous avons intégré des fonctionnalités avancées de contrôle d'accès et de gestion des identités pour répondre aux exigences de protection des données personnelles imposées par des lois telles que le RGPD Règlement Général sur la Protection des Données,0,0,1,Synthetic,Cybersécurité
Nomena RAMAHEFA       Aviation Assistant        and UNHAS Trainer,0,0,0,UNHAS,
"The fleet thus  comprised two Mil Mi-17 and one Super Puma, the latter funded by the Directorate-General for European Civil Protection and Humanitarian Aid Operations (DG-ECHO) of the  European Commission.",0,0,0,UNHAS,
Cameroon | Gerhard Bezuidenhout | gerhard.bezuidenhout@wfp.org,0,0,0,UNHAS,
Grâce à notre programme de remise en forme communautaire les résidents peuvent maintenant profiter d'activités physiques et de loisirs à proximité augmentant leur liberté de choix en matière de santé et de bienêtre,0,1,0,Synthetic,Liberté
"LATER-DAY SAINTS 100,000 destinations reached (5 regular | 2 ad hoc)",0,0,0,UNHAS,
Grâce à cette solution d'automatisation des processus une entreprise de services financiers a pu réduire de 60 % le temps nécessaire pour traiter les demandes de prêts augmentant ainsi sa capacité à gérer un plus grand volume d'affaires,1,0,0,Synthetic,Efficacité_accrue
Notre solution permet aux habitants de découvrir des restaurants locaux offrant des expériences culinaires uniques ce qui les encourage à explorer leur propre communauté et à soutenir les entreprises locales,0,1,0,Synthetic,Offre_touristique
"In 2023, the air  service transported over 1,300 passengers and 13 metric tons of cargo.",0,0,0,UNHAS,
En optant pour nos solutions les entreprises bénéficient d'un accompagnement personnalisé pour assurer une mise en conformité efficace et durable avec les obligations légales liées au Contrôle reglementaire,0,0,1,Synthetic,Contrôle_reglementaire
Les centres de loisirs équipés de notre produit offriront des programmes sportifs des cours de danse et des activités récréatives visant à promouvoir un mode de vie actif et sain au sein de la communauté,0,1,0,Synthetic,Lieu_de_convivialité
Grâce à notre produit les habitants peuvent participer à des activités de groupe axées sur la pleine conscience et le bienêtre physique favorisant ainsi un mode de vie équilibré,0,1,0,Synthetic,Expertises
