sentence,roi,notoriete,obligation,source,sub_category
Nous avons investi dans la recherche et le développement pour nous assurer que nos produits sont en conformité avec les exigences légales et réglementaires les plus récentes,0,0,1,Synthetic,Remise_en_conformité
"Furthermore, an additional 1,392 people – including staff, air operators, contractors, NGOs, partners, and national authorities – received aviation security training on topics such as General Security Awareness, International Civil",0,0,1,UNHAS,
Nos programmes de soutien aux personnes âgées offrent aux aînés de la communauté des occasions de socialiser de recevoir de l'aide et de contribuer à des activités ce qui peut améliorer leur bienêtre social et émotionnel,0,1,0,Synthetic,Bien_être
Notre expertise en matière de conformité légale et réglementaire nous permet de proposer des produits et solutions parfaitement adaptés aux exigences spécifiques liées à la prise de décision gouvernementale,0,0,1,Synthetic,Décision_gouvernemental
"Since the beginning of 2020, the country has been affected by increasing internal insecurity and regional dynamics, driving population   displacement, refugee influxes, and growing humanitarian needs.",0,0,0,UNHAS,
En fournissant des stations de recyclage pratiques nous aidons les habitants à adopter des habitudes respectueuses de l'environnement tout en maintenant la propreté de leur quartier,0,1,0,Synthetic,Propreté
En offrant des cours de recyclage et des outils de sensibilisation environnementale nous encourageons les résidents à adopter des pratiques durables qui améliorent la qualité de vie pour tous,0,1,0,Synthetic,Amélioration_de_la_qualité_de_vie
Nous proposons des fonctionnalités de gestion des risques et de contrôle qualité pour assurer le respect des normes légales et réglementaires relatives au Maintien en conditions opérationnelles,0,0,1,Synthetic,Maintien_en_conditions_opérationnelles
"Following receipt of the request, the WFP Aviation Service carries out a feasibility assessment of the air services that have been requested.",0,0,0,UNHAS,
"Like other countries in East Africa, Kenya is struggling to recover after five consecutive rainy seasons where rainfall was below average resulting in one of the worst droughts in recent history.",0,0,0,UNHAS,
Nous offrons des outils de suivi et de reporting qui vous permettront de documenter et de prouver facilement la conformité de votre entreprise aux normes légales en matière de maintien en conditions opérationnelles des équipements,0,0,1,Synthetic,Maintien_en_conditions_opérationnelles_des_équipement
"Therefore, the current cost recovery will be adjusted from 12 per cent to 29 per cent, following the approval of the UNHAS Steering Committee in October 2023.",1,0,0,UNHAS,
The service increased the frequency of weekly flights from two to eight to,1,1,0,UNHAS,
"Requests are accommodated on a first-come,   first-served basis, and in line with the passenger    prioritization system as outlined in the WFP Aviation Policy (more on page 89).",0,0,0,UNHAS,
The aircraft cruises at about 470 knots (871 km/h).,0,0,0,UNHAS,
En formant notre personnel aux bonnes pratiques environnementales nous avons pu minimiser nos dépenses liées aux amendes et autres coûts indirects liés à la nonconformité environnementale améliorant ainsi notre coût de fonctionnement,1,0,0,Synthetic,Coût_de_fonctionnement
Grâce à nos solutions vos clients pourront facilement gérer les consentements en matière de traitement des données ce qui est crucial pour respecter les exigences de la législation sur la confidentialité,0,0,1,Synthetic,Protection_de_la_confidentialité
En automatisant les processus de paie et d'avantages sociaux cette solution permettra de réduire les erreurs et les coûts liés à la gestion de la rémunération des employés,1,0,0,Synthetic,Economie_de_personelle
Nos produits intègrent des fonctionnalités de suivi et de traçabilité qui vous permettent de respecter les obligations légales liées à la chaîne d'approvisionnement et à la provenance des produits,0,0,1,Synthetic,Obligation_réglementaire
Words from UNHAS user,0,0,0,UNHAS,
En utilisant cette technologie les équipes de vente pourront gérer plus efficacement leur temps en automatisant certaines tâches administratives ce qui leur laissera plus de temps pour prospecter de nouveaux clients,1,0,0,Synthetic,Gain_de_temps
En choisissant nos solutions nos clients bénéficient d'une tranquillité d'esprit quant à leur conformité légale en matière d'Inspection réglementaire ce qui leur permet de se concentrer sur leur activité principale en toute sérénité,0,0,1,Synthetic,Inspection_reglementaire
Les équipes de service client ont réduit de 25% leur temps de réponse aux demandes des clients après avoir mis en place cette solution ce qui a entraîné une augmentation de la satisfaction client,1,0,0,Synthetic,Amélioration_de_la_performance_
Une entreprise de ecommerce peut mettre en œuvre la modélisation des prix pour ajuster ses tarifs en temps réel en fonction des conditions du marché ce qui peut améliorer sa compétitivité et ses revenus,1,0,0,Synthetic,Modélisation_des_pricings
En soutenant les initiatives de création d'emplois locaux notre solution contribue à renforcer l'inclusion économique des résidents et à réduire les inégalités,0,1,0,Synthetic,Inclusion
Nos solutions intègrent des fonctionnalités de reporting et d'analyse qui aident nos clients à identifier les écarts de conformité en matière d'Inspection réglementaire et à prendre rapidement des mesures correctives,0,0,1,Synthetic,Inspection_reglementaire
"Therefore, it is crucial to keep UNHAS operations financially sustainable.",0,0,1,UNHAS,
En utilisant notre solution les résidents locaux peuvent facilement trouver des partenaires de sport pour s'entraîner ensemble ce qui favorise la socialisation et les rencontres,0,1,0,Synthetic,Sport
En utilisant cette solution nous avons pu suivre de près nos coûts et nos dépenses liés à nos projets ce qui nous a permis d'identifier les gaspillages et les inefficacités et de les corriger rapidement,1,0,0,Synthetic,Bon_déroulement_des_projets
Growing up I had two  big dreams that seemed   incompatible at the time: work for a humanitarian organization and work in the aviation industry.,0,0,0,UNHAS,
En choisissant nos solutions nos clients sont en mesure de garantir la conformité de leurs opérations avec les lois et réglementations en vigueur minimisant ainsi les risques juridiques potentiels,0,0,1,Synthetic,Réglementation
Niger | Mirwais Motakef | mirwais.motakef@wfp.org,0,0,0,UNHAS,
Grâce à ce produit convivial nos équipes ont pu collaborer plus efficacement réduisant ainsi les délais de livraison des projets et améliorant la satisfaction des clients,1,0,0,Synthetic,Facile_d'utilisation_
Les personnes de tous âges peuvent participer à des activités de remise en forme et de bienêtre ce qui favorise un mode de vie sain et actif pour tous,0,1,0,Synthetic,Inter-génerationnel
Un hôtel a utilisé ce produit pour mieux gérer la planification de son personnel ce qui a permis d'améliorer la productivité et la satisfaction des employés tout en réduisant les coûts liés au personnel,1,0,0,Synthetic,Optimisation_des_effectif
En utilisant cette solution de gestion des stocks nous avons pu réduire nos stocks excédentaires et minimiser les coûts de stockage améliorant ainsi notre trésorerie et notre rentabilité,1,0,0,Synthetic,Bénefices
"In the pursuit of an ever more effective service, WFP Aviation is always looking to apply new technology in its operations.",0,0,0,UNHAS,
This best practice is also being developed for other countries where the need is emerging.,0,0,0,UNHAS,
Une entreprise de fabrication peut utiliser l'agrégation de données pour rassembler les données de production de qualité et de maintenance afin d'identifier les goulots d'étranglement d'optimiser les processus et d'améliorer l'efficacité opérationnelle,1,0,0,Synthetic,Aggrégation_de_données
"This is an adventure, every day is different",0,0,0,UNHAS,
"In December 2023, the withdrawal of the United Nations Multidimensional mission (MINUSMA) increased the need for wider service coverage.",0,0,0,UNHAS,
En intégrant cette solution à leurs opérations une entreprise de fabrication a pu mieux planifier et coordonner ses opérations ce qui a permis d'augmenter sa capacité de production sans investir dans de nouveaux équipements,1,0,0,Synthetic,Optimiser_la_production
Cabin waste management guidelines development: The WFP Aviation Service has developed cabin waste management guidelines to assist contracted air carriers in defining and aligning their cabin waste management processes.,1,0,0,UNHAS,
Créer des zones piétonnes et des pistes cyclables sécurisées encouragerait les habitants à marcher et à faire du vélo pour leurs déplacements du quotidien,0,1,0,Synthetic,Offre_de_mobilité
"This Annual Review provides a full, detailed appraisal and set of insights into UNHAS performance in 2023.",0,0,0,UNHAS,
En offrant des services de proximité tels que des programmes de soutien aux familles des services de garde ou des activités pour les personnes âgées notre solution améliore la qualité de vie des résidents de tous âges,0,1,0,Synthetic,Optimisation_de_la_qualité_d'usages
Photos 2 page 82: WFP/Alaa Noaman,0,0,0,UNHAS,
UNHAS in a nutshell,0,0,0,UNHAS,
Notre solution permettra de mettre en place des équipements sportifs et de loisirs pour tous les âges ce qui contribuera à attirer une population diversifiée en quête d'activités variées,0,1,0,Synthetic,Attractivité_territoriale
UNHAS provided vital operational support and services across the world in 2023.,0,0,0,UNHAS,
Grâce à l'implémentation de cette solution une entreprise de services financiers a pu gérer un plus grand nombre de transactions ce qui a conduit à une croissance significative de son activité,1,0,0,Synthetic,Capacité_accrue
"This year, 86 regular flights, and two chartered flights were conducted.",0,0,0,UNHAS,
Grâce à des partenariats avec des entreprises locales notre solution peut offrir des opportunités d'emplois saisonniers ou à temps partiel adaptées aux besoins des résidents,0,1,0,Synthetic,Accès_à_l'emploi
Notre produit permettra aux résidents de bénéficier d'un accès amélioré aux soins de santé et aux services sociaux garantissant ainsi la pérennité des systèmes de soutien communautaire,0,1,0,Synthetic,Pérenité
Grâce à nos produits les clients peuvent automatiser les processus de conformité et réduire les risques d'écart par rapport aux exigences légales en matière de Maintien en conditions opérationnelles,0,0,1,Synthetic,Maintien_en_conditions_opérationnelles
The PSS and PASS surveys   conducted by UNHAS Afghanistan at the end of 2023 showed an overall satisfaction rate of    respectively 93 per cent and 95 per cent.,0,1,0,UNHAS,
En mettant en œuvre cette solution notre entreprise a pu améliorer la satisfaction de nos clients en respectant les délais et les spécifications des projets ce qui a conduit à une augmentation de la fidélité des clients et à des recommandations positives,1,0,0,Synthetic,Bon_déroulement_des_projets
"Additionally, special flights were  performed to relocate humanitarian staff and their dependants crossing the border from Sudan to South  Sudan.",0,0,0,UNHAS,
"By providing air transport for humanitarian and    development workers as well as lifesaving supplies,   UNHAS facilitates the delivery of assistance to vulnerable populations, bridging the gap between relief efforts and those in need.",1,1,0,UNHAS,
managed EU HAF    transported over 700    passengers and 156 tons of cargo.,0,0,0,UNHAS,
"A synergistic approach was developed and implemented to guarantee the coordination of flight routes, fostering partnerships with local Civil Aviation    Authorities (CAA), other humanitarian air service providers, as well as security networks within the areas of operation.",1,0,1,UNHAS,
"The insecurity in Mali caused   significant population displacement, increasing the humanitarian needs in all sectors.",0,0,0,UNHAS,
Celebrating 20 years since UNHAS creation .,0,0,0,UNHAS,
"ERP) – Tabletop Scenarios, and the Drug Alcohol Management Programme (DAMP).",0,0,1,UNHAS,
Avec nos solutions nos clients bénéficient d'un accompagnement continu pour rester en conformité avec les évolutions légales et réglementaires minimisant ainsi tout risque lié à la nonconformité,0,0,1,Synthetic,Remise_en_conformité
En mettant en place des programmes de santé communautaire notre solution encourage les résidents à adopter des modes de vie sains ce qui contribue à améliorer leur sentiment de bienêtre général,0,1,0,Synthetic,Sentiment_de_bien_être
Ce produit permet aux entreprises de facilement exploiter les fonctionnalités de suivi des activités en ligne pour optimiser leurs campagnes publicitaires et obtenir un meilleur retour sur investissement,1,0,0,Synthetic,Facilement_exploitable
Ce produit nous a permis d'automatiser certains processus ce qui a libéré du temps pour nos employés et a permis une meilleure utilisation de leurs compétences augmentant ainsi notre rentabilité,1,0,0,Synthetic,Bénefices
"Drought is a major driver of food insecurity, and while sufficient rainfall has given relief (water availability and pasture) to previously drought-affected areas, recovery from the drought will take several years.",0,0,0,UNHAS,
United Nations Aviation Standards for Peacekeeping and Humanitarian Air Transport Operations,0,0,1,UNHAS,
UNHAS | Annual Review 2023 36 Date | Brochure title,0,0,0,UNHAS,
About         field support,0,0,0,UNHAS,
Nos produits et solutions sont conformes aux normes et réglementations environnementales en vigueur ce qui garantit une réduction significative des émissions polluantes,0,0,1,Synthetic,Respect_des_règles_sur_les_emissions_des_polluants
Intégration de solutions de connectivité numérique pour offrir aux résidents un accès facile à l'information aux services en ligne et aux opportunités d'apprentissage,0,1,0,Synthetic,Modernisation
"Moreover, climate extremes are making established rainfall patterns more erratic and hazards more severe, impacting food security as well as disease outbreaks and displacement.",1,1,0,UNHAS,
En analysant les données d'inventaire et de ventes les commerçants peuvent prévoir plus précisément la demande future réduisant ainsi les coûts liés à la surstockage ou à la rupture de stock,1,0,0,Synthetic,Monétisation_de_la_donnée
Nigeria | Conny Akerstrom | conny.akerstrom@wfp.org,0,0,0,UNHAS,
"In Haiti, the earthquake, tropical storms, and growing insecurity  required enhanced access to affected communities: UNHAS stepped up and delivered.",1,1,1,UNHAS,
The WFP Aviation Service has a total of over 144 aircraft including medium,0,0,0,UNHAS,
"The effects of    COVID-19, intercommunal violence, flooding, among others further   deepened extreme poverty and   hampered private sector prospects and livelihood improvements.",0,0,0,UNHAS,
January February March May April June,0,0,0,UNHAS,
En mettant en place des programmes de sensibilisation à la sécurité personnelle nous aidons les citoyens à se sentir plus en sécurité et à réduire leur anxiété quotidienne,0,1,0,Synthetic,Sérenité
"UNHAS represents the only safe way to reach remote areas of the country to provide the much-needed   assistance to vulnerable beneficiaries and remains the most reliable, flexible, and cost-effective option for transporting     humanitarian cargo and personnel in the country.",1,1,1,UNHAS,
"The aviation security team, working in collaboration with the regional Aviation Safety Unit, conducted  rigorous safety and security trainings for air operators, airport authorities, and field focal points.",0,0,1,UNHAS,
En choisissant nos produits vous pourrez répondre aux exigences légales liées à la conformité fiscale évitant ainsi tout risque de nonconformité ou de litiges avec les autorités fiscales,0,0,1,Synthetic,Obligation_réglementaire
En équipant les parcs locaux de stations de musculation en plein air notre solution encourage les résidents à adopter un mode de vie plus actif et à améliorer leur bienêtre physique,0,1,0,Synthetic,Equipement_sportif
"From March, these two separate routes were  combined: Doha – Dubai – Kabul and back.",0,0,0,UNHAS,
Nos produits intègrent des fonctionnalités spécifiques permettant de générer des rapports détaillés et documentés pour justifier de la conformité aux règlementations en matière de Contrôle reglementaire,0,0,1,Synthetic,Contrôle_reglementaire
"NORWAY 1,448,590 CANADA 1,158,539 in need inside Sudan,  arranging for cross-border delivery of supplies, and reliable humanitarian access of personnel.",0,0,0,UNHAS,
Les résidents à faible revenu peuvent utiliser notre solution de transport en commun abordable pour accéder aux services essentiels tels que les hôpitaux les centres commerciaux ou les administrations publiques,0,1,0,Synthetic,Transport_en_commun
Nos produits intègrent des mesures de sécurité avancées pour protéger les données personnelles de nos clients en conformité avec les normes de protection de la vie privée,0,0,1,Synthetic,Respect_de_la_vie_privée_au_sens_légal
La vitesse de calcul nous permet d'automatiser certaines tâches répétitives ce qui libère du temps pour nos employés afin qu'ils puissent se concentrer sur des tâches à plus forte valeur ajoutée,1,0,0,Synthetic,Vitesse_de_calcul
Date | Brochure title UNHAS | 2021 Overview 14 Global Humanitarian Overview 2024 [EN/AR/FR/ES] - World | ReliefWeb.,0,0,0,UNHAS,
Avec cette solution nos équipes de développement de produits pourraient collaborer de manière plus efficace réduisant ainsi les temps de mise sur le marché et augmentant le retour sur investissement pour chaque nouveau produit,1,0,0,Synthetic,éfficacité_des_interventions
Nos produits sont conçus en conformité avec les normes et réglementations en vigueur ce qui garantit à nos clients une tranquillité d'esprit en matière de conformité légale,0,0,1,Synthetic,Réglementation
Nos solutions incluent des outils de gestion des droits d'accès qui vous aident à vous conformer aux exigences de protection des données et de limitation des accès imposées par la législation sur la confidentialité,0,0,1,Synthetic,Protection_de_la_confidentialité
Nos produits et solutions sont régulièrement mis à jour pour prendre en compte toute évolution de la législation en matière de santé au travail assurant ainsi à nos clients une conformité permanente aux règles en vigueur,0,0,1,Synthetic,Respects_des_règles_de_santé_au_travail
"After the drought ended, Kenya experienced heavier-than-usual rains that brought floods, ravaging parts of central, coastal, southeastern, north",0,0,0,UNHAS,
Air assets are deemed practical to support the relief operation.,0,0,0,UNHAS,
En utilisant ce produit les managers pourront suivre plus facilement les performances de leur équipe ce qui leur fera gagner du temps dans l'analyse des données et la prise de décision,1,0,0,Synthetic,Gain_de_temps
En utilisant l'homogénéisation des données nous avons pu identifier des inefficacités dans nos processus opérationnels et les corriger ce qui a conduit à des gains de productivité et à une réduction des coûts liés aux retards et aux erreurs,1,0,0,Synthetic,Homogéinisation_des_données_
Grâce à ce produit les équipes de construction peuvent optimiser la planification des tâches et minimiser les retards ce qui se traduit par des projets achevés plus rapidement et des économies de coûts,1,0,0,Synthetic,éfficacité_des_interventions
"Yemen remains among the world’s most concerning humanitarian crises, with over nine years of conflict, climate-related shocks, ongoing economic crisis and disrupted public services.",0,0,0,UNHAS,
En optimisant nos flux de distribution nous avons pu améliorer la satisfaction client en livrant plus rapidement les commandes ce qui a conduit à une augmentation de notre part de marché et à une croissance de nos revenus,1,0,0,Synthetic,Optimisation_des_flux
En simplifiant notre chaîne logistique nous avons pu réduire les délais de livraison et les coûts d'entreposage ce qui a eu un impact direct sur notre rentabilité,1,0,0,Synthetic,Simplification
"Recognizing the pivotal role of strategic collaborations in this endeavour, WFP has forged partnerships with leading",0,0,0,UNHAS,
Grâce à l'utilisation de technologies de réalité augmentée notre solution offrira des visites guidées interactives des sites historiques locaux permettant aux résidents de découvrir et d'apprécier l'histoire de leur communauté,0,1,0,Synthetic,Valorisation_de_lieux_de_rencontres
Mettre en place des services de navettes pour les jeunes et les personnes âgées aiderait à renforcer le lien social au sein de la communauté,0,1,0,Synthetic,Offre_de_mobilité
En adoptant des pratiques de gestion des risques environnementaux notre entreprise peut éviter les coûts liés aux infractions environnementales et améliorer notre image de marque ce qui stimule notre activité et nos revenus,1,0,0,Synthetic,Maitrise_des_risques
Les enfants peuvent bénéficier de modèles positifs et de mentors dans leur propre communauté ce qui renforce leur estime de soi et leur confiance en l'avenir,0,1,0,Synthetic,Inter-génerationnel
En choisissant nos produits nos clients peuvent être assurés de respecter pleinement les lois et règlements en matière de Décision gouvernemental ce qui renforce leur crédibilité et leur légitimité aux yeux des autorités compétentes,0,0,1,Synthetic,Décision_gouvernemental
Nous travaillons en étroite collaboration avec nos fournisseurs pour nous assurer que nos produits respectent toutes les lois et réglementations relatives aux droits de l'homme offrant ainsi une assurance de conformité à nos clients,0,0,1,Synthetic,Respects_du_droit_de_l'homme_au_sens_légale
"In May 2023, the operation experienced an increase in airport operational costs.",0,0,0,UNHAS,
Une entreprise de télécommunications peut utiliser l'agrégation de données pour consolider les données provenant de différents réseaux et systèmes afin d'optimiser la capacité d'améliorer la qualité de service et de réduire les coûts d'exploitation,1,0,0,Synthetic,Aggrégation_de_données
Grâce à l'utilisation du produit de subvention une organisation à but non lucratif a bénéficié d'une subvention gouvernementale qui a couvert 50% des coûts liés à la mise en place d'un programme de sensibilisation,1,0,0,Synthetic,Subvention
Nous mettons à disposition des formations et des ressources pour sensibiliser et former le personnel de nos clients aux meilleures pratiques en matière d'Inspection réglementaire contribuant ainsi à une meilleure conformité,0,0,1,Synthetic,Inspection_reglementaire
Grâce à nos formations en premiers secours et en sécurité les résidents sont mieux préparés à faire face aux situations d'urgence et à contribuer à la sécurité publique de la communauté,0,1,0,Synthetic,Formations
Photo page 4: WFP/Rein Skullerud,0,0,0,UNHAS,
En choisissant nos solutions nos clients bénéficient d'une documentation complète et conforme aux réglementations en vigueur facilitant ainsi les processus d'audit et de conformité,0,0,1,Synthetic,Sureté
"UNHAS is continuously working to serve additional locations, pending government approvals and as soon as safety conditions are met.",0,0,1,UNHAS,
Grâce à ce produit facile à adapter notre équipe a pu personnaliser rapidement l'interface pour répondre aux besoins spécifiques de nos clients améliorant ainsi la satisfaction et fidélisant la clientèle,1,0,0,Synthetic,Facile_d'utilisation_
"In 2023, the PSS and PASS surveys showed an overall user satisfaction rate of 95 per cent and 93 per cent respectively.",0,1,0,UNHAS,
En mettant en place des contrôles de conformité stricts notre entreprise peut éviter les amendes et les pénalités liées aux nonconformités réglementaires ce qui se traduit par des économies financières significatives,1,0,0,Synthetic,Maitrise_des_risques
"A 50-seat aircraft is powered by two turbofans, mounted on the rear fuselage.",0,0,0,UNHAS,
Une solution de maitrise de la stratégie peut aider une entreprise à mieux cibler son marché et à optimiser ses efforts de marketing pour maximiser le retour sur investissement,1,0,0,Synthetic,Maitrise_de_la_stratégie
UNHAS also collaborates with national authorities in its countries of operation to maintain and rehabilitate  aviation infrastructure as the needs may arise.,0,0,0,UNHAS,
UNHAS | Annual Review 2023 80 Date | Brochure title,0,0,0,UNHAS,
"UNHAS has been operational in Mali since 2012, following the outbreak of internal conflict which required a large-scale humanitarian response in the northern and central regions of the country.",0,0,0,UNHAS,
"Operating since 2012 to provide crucial access to areas that are hard to reach due to     long distances, limited infrastructure, no reliable commercial air operators, and insecurity.",0,0,1,UNHAS,
Grâce à nos initiatives de nettoyage des espaces publics les citoyens pourront profiter de parcs et de rues plus propres et attrayants,0,1,0,Synthetic,Propreté
Une stratégie bien maîtrisée peut permettre à une entreprise de prendre des décisions plus éclairées en matière d'investissement ce qui peut maximiser le rendement sur le capital investi,1,0,0,Synthetic,Maitrise_de_la_stratégie
"WFP Aviation Service participation in the ICAO ACT-SAF programme: In the third quarter of 2023, the WFP Aviation",0,0,0,UNHAS,
Franklyn Frimpong Chief of Aviation UN World Food Programme,0,0,0,UNHAS,
