sentence,roi,notoriete,obligation,source,sub_category
Grâce à nos solutions de gestion des accès et des droits nous aidons nos clients à respecter les exigences de protection des données personnelles imposées par la législation en matière de confidentialité,0,0,1,Synthetic,Confidentialité_des_données
Un fournisseur de services publics a mis en œuvre cette solution pour optimiser l'utilisation des infrastructures ce qui a permis de prolonger la durée de vie des actifs et de réduire les coûts de maintenance,1,0,0,Synthetic,Optimisation_des_ressources_
Central African Republic | Kaviraj Khadun | kaviraj.khadun@wfp.org,0,0,0,UNHAS,
"Through out 2023, the operation worked towards reducing operational cost by fleet optimization, route  network restructuring, use of long range/fuel-efficient short takeoff and landing (STOL) aircraft, and maximizing   payload through both passenger and cargo.",1,0,0,UNHAS,
Directorate-General for European Civil Protection and Humanitarian Aid   Operations DR Doctor DG ECHO DRC Democratic Republic of the Congo EEC European Economic Community E-GPUs Electric-Ground Power Units EMS Environmental Management Systems,0,0,0,UNHAS,
En collaborant avec d'autres résidents pour organiser des événements locaux les citoyens peuvent accroître leur visibilité et être reconnus en tant que contributeurs dynamiques à la vie communautaire,0,1,0,Synthetic,Notorité
Une entreprise de logistique peut utiliser l'agrégation de données pour consolider les données provenant de différents systèmes de suivi et de gestion des stocks afin d'optimiser les itinéraires de livraison réduire les coûts d'exploitation et améliorer la satisfaction client,1,0,0,Synthetic,Aggrégation_de_données
Notre solution offre une traçabilité des contenus pour s'assurer de l'origine légale des ressources utilisées contribuant ainsi à la conformité avec les réglementations en matière de propriété intellectuelle,0,0,1,Synthetic,Respect_de_la_propriété_intellectuelle
"UNHAS is not a commercial airline; it is a mandated   common service managed by the World Food Programme (WFP), extending its support not only to UN personnel deployed in the field but to all humanitarian and    development workers.",0,1,0,UNHAS,
En améliorant la virtualisation de leurs serveurs les entreprises peuvent réduire leurs coûts matériels et énergétiques tout en améliorant la flexibilité de leur infrastructure,1,0,0,Synthetic,Optimisation_de_l'infrastructure
En modernisant nos systèmes de communication nous pourrons améliorer notre service client et renforcer notre relation avec nos clients ce qui nous aidera à fidéliser nos clients actuels et en attirer de nouveaux,1,0,0,Synthetic,Modérnisation_des_installations
Notre solution aidera les résidents à trouver des logements situés à proximité de services essentiels tels que les écoles les centres de santé les transports en commun et les commerces améliorant ainsi leur qualité de vie,0,1,0,Synthetic,Accès_aux_logements
Photo page 47: WFP/Benoît Lognoné,0,0,0,UNHAS,
"In 2023, the number of people in need in Mozambique increased to an estimated 2 million according to the Humanitarian Response Plan.",0,0,0,UNHAS,
"Through the skies of Afghanistan, I’ve learned that   true courage takes flight not only in the flightdeck",0,0,0,UNHAS,
Les enfants peuvent apprendre des compétences précieuses et des leçons de vie en interagissant avec des personnes âgées telles que la patience la persévérance et le respect,0,1,0,Synthetic,Inter-génerationnel
Nous proposons des outils de suivi des congés des arrêts maladie et des absences pour garantir le respect des obligations légales en matière de gestion du temps de travail et de rémunération,0,0,1,Synthetic,Respect_du_droit_de_travail
En choisissant nos produits vous répondez aux exigences légales en matière de protection individuelle et vous assurez la sécurité de vos collaborateurs,0,0,1,Synthetic,Protection_Individuelle
Notre solution offre aux résidents la possibilité de participer à des projets de bénévolat et d'engagement communautaire pour renforcer le tissu social et la solidarité locale,0,1,0,Synthetic,Attractivité_endogène
The WFP Aviation Service has embarked on an Environmental and Sustainability Programme to operationalise its commitment to continuous environmental improvement and the reduction of the carbon footprint of all aviation related services in line with WFP’s environmental policy.,1,1,0,UNHAS,
UNHAS Kenya has been managing EU HAF to   provide support to ECHO- funded humanitarian   activities.,0,0,0,UNHAS,
Notre solution de collecte sélective des déchets permettra de réduire la quantité de déchets envoyés en décharge contribuant ainsi à la préservation de l'environnement,0,1,0,Synthetic,Propreté
UNHAS monitors and evaluates the effectiveness of   service delivery through regular interaction with its users and their personnel.,0,0,0,UNHAS,
Grâce à la mise en conformité de nos données nous avons pu améliorer notre efficacité opérationnelle en réduisant le temps et les ressources nécessaires pour traiter les données de manière manuelle,1,0,0,Synthetic,Mise_en_conformité_de_données
La mise en place facile et rapide de cette plateforme de formation en ligne a permis à notre entreprise de former plus rapidement et à moindre coût nos employés ce qui a entraîné une amélioration de la productivité et une réduction des coûts de formation,1,0,0,Synthetic,Facilité_et_rapidité_de_déploiment
"Additionally, the program engages in capacity-building initiatives tailored for government aviation personnel, further strengthening the aviation sector's operational efficiency and effectiveness.",1,0,0,UNHAS,
Grâce à notre solution de mobilité durable les résidents peuvent accéder plus facilement à des services essentiels tels que les soins de santé l'éducation et les zones commerciales contribuant ainsi à renforcer la cohésion sociale au sein de la communauté,0,1,0,Synthetic,Mobilité_durable
Un organisme de formation a pu améliorer son retour sur investissement en obtenant des subventions pour développer de nouveaux programmes éducatifs ce qui a attiré plus d'étudiants et augmenté ses revenus,1,0,0,Synthetic,Subvention
UNHAS             contributions timeline,0,0,0,UNHAS,
T +39 06 65131 wfp.org/unhas,0,0,0,UNHAS,
En assurant la fiabilité des réseaux de gaz les résidents pourront cuisiner et chauffer leur maison en toute tranquillité ce qui contribuera à leur confort et à leur bienêtre,0,1,0,Synthetic,Fiabilité_des_infrastructures_urbaines
En soutenant les initiatives de jardins communaux et de compostage notre solution encourage les résidents à collaborer dans des projets environnementaux renforçant ainsi leur engagement envers la durabilité et la préservation de leur environnement local,0,1,0,Synthetic,Renforcement_des_liens_communautaire
En choisissant cette solution facile à personnaliser notre équipe marketing a pu créer des campagnes ciblées plus rapidement ce qui a conduit à une augmentation du taux de conversion et à une hausse des ventes,1,0,0,Synthetic,Facile_d'utilisation_
Mali | Hamza Abdalla | hamza.abdalla@wfp.org,0,0,0,UNHAS,
En utilisant notre solution les résidents peuvent accéder facilement à des services de santé locaux et rester en bonne santé tout au long de l'année,0,1,0,Synthetic,Services_aux_citoyens
UN Booking App or visit UNBooking.org booking submission process.,0,0,0,UNHAS,
"On average, UNHAS   transported 215 passengers and 0.27 metric tons of cargo, every month.",0,0,0,UNHAS,
Avec nos outils de gestion des consentements et des préférences utilisateur vous pourrez facilement respecter les dispositions de la législation en matière de protection des données personnelles et de vie privée,0,0,1,Synthetic,Sécurité_des_données
En intégrant notre solution dans les festivals et les événements communautaires nous contribuerons à créer des expériences enrichissantes unissant les résidents autour de moments de joie et de célébration,0,1,0,Synthetic,Lieu_de_convivialité
Nos équipements sportifs permettent aux résidents de s'engager dans des activités de plein air favorisant ainsi un mode de vie sain et actif au sein de la communauté,0,1,0,Synthetic,Equipement_sportif
"In this context, a Concept of Operations (CONOPS) was developed that established regular air transport service to and from Sudan,  providing the humanitarian community with reliable air access to Port Sudan to enable the implementation of humanitarian   programmes.",1,1,0,UNHAS,
Notre plateforme encourage l'utilisation partagée des véhicules ce qui permet aux résidents de réduire les coûts de transport individuels tout en favorisant une utilisation plus efficace des ressources,0,1,0,Synthetic,Mobilité_durable
"Twin-engine regional jets, 37-passenger capacity.",0,0,0,UNHAS,
"In line with our commitment to continuous environmental improvement and the reduction of our carbon footprint, WFP Aviation has  embarked upon key initiatives this year,   including cabin waste management guidelines.",0,1,0,UNHAS,
Grâce à la mise en œuvre de cette solution les entreprises peuvent améliorer l'efficacité opérationnelle de leurs infrastructures ce qui se traduit par des économies de temps et d'argent,1,0,0,Synthetic,Optimiser_les_infrastructures
UNHAS Somalia destinations reached (14 regular | 25 ad hoc) aircraft   (including 1 rotary-wing),0,0,0,UNHAS,
"Since then, the service has ensured   essential access for humanitarian  actors to conflict-affected areas in northern Mozambique.",1,1,1,UNHAS,
Mali 0.7M Chad 0.6M,0,0,0,UNHAS,
UNHAS | Annual Review 2023 72 Date | Brochure title,0,0,0,UNHAS,
En offrant un accès facile à des services de santé et de bienêtre notre solution aide à améliorer la santé et le bienêtre des résidents les rendant ainsi plus attractifs pour les investisseurs et les nouvelles recrues,0,1,0,Synthetic,Attractivité_exogène
Haiti | German Puente | german.puente@wfp.org,0,0,0,UNHAS,
"Providing safe and reliable flights in Afghanistan in adverse weather conditions, poor air navigation services, disasters, and a volatile political environment.",0,0,1,UNHAS,
En mettant en place des initiatives de réduction des déchets nous avons réduit nos coûts de gestion des déchets de 20%,1,0,0,Synthetic,Rédution_des_coûts_de_fonctionnements
En utilisant notre application les résidents peuvent trouver des options de stationnement abordables et économiser de l'argent sur les frais de stationnement élevés,0,1,0,Synthetic,Facilité_de_stationnement_
"For the two months it operated, the helicopter transported 734 passengers and 156 mt of aid cargo to hard-to-reach locations for 14 humanitarian organisations.",0,0,0,UNHAS,
"Through its three aircraft (two Beechcraft 1900D and one Dornier 228), the operation provided regular   services from Bamako to Mopti,   Timbuktu, Gao and the remote  airstrip of Menaka.",0,0,0,UNHAS,
STM US Share The Meal United States SSC Significant Security Concern,0,0,1,UNHAS,
Nos produits et solutions sont conçus en respectant les normes et réglementations en vigueur en matière de codes de marchés publics garantissant ainsi une conformité totale pour nos clients,0,0,1,Synthetic,Respect_des_codes_de_marchés_publiques
Grâce à notre solution de réseautage social local les résidents peuvent participer à des événements communautaires rejoindre des groupes d'intérêt locaux et rester connectés avec leurs voisins renforçant ainsi le tissu social de la communauté,0,1,0,Synthetic,Inclusion_numérique
"If there is no Country Office, the request is made through the WFP Regional Director.",0,0,0,UNHAS,
Fanirisoa ANDRIAMAMPIANINA   Aviation Assistant        and Customer Service,0,0,0,UNHAS,
The United Nations Humanitarian Air Service (UNHAS) is one of the primary services that WFP Aviation provides to the humanitarian community.,0,0,0,UNHAS,
"Although the end of 2022 brought about peace in Ethiopia, humanitarian needs stemming from a two-year conflict were still high in 2023.",0,0,0,UNHAS,
Photo page 31: WFP/Photo Library,0,0,0,UNHAS,
"In 2023, the PSS and PASS surveys showed an overall satisfaction rate of 99 per cent and 100 per cent respectively.",0,1,0,UNHAS,
This represented an increase of 25   per cent compared with the previous year.,0,0,0,UNHAS,
En encourageant la participation à des campagnes de nettoyage communautaire les résidents se sentent plus investis dans la préservation de leur environnement local,0,1,0,Synthetic,Propreté
En choisissant nos produits et solutions les clients minimisent les risques liés à la nonconformité réglementaire et bénéficient de la tranquillité d'esprit,0,0,1,Synthetic,Certifications
En adoptant des processus de production standardisés les entreprises peuvent réduire les coûts de maind'œuvre et de formation tout en optimisant l'utilisation des équipements et des matières premières,1,0,0,Synthetic,Economie_d'echelle
"In accordance with WFP’s aviation policy, the generated cost recovery throughout the year should ensure operational continuity for a minimum period of three months at any given time.",1,0,1,UNHAS,
Notre produit peut faciliter l'accès à des activités de loisirs et de détente pour les personnes âgées ce qui contribue à renforcer leur bienêtre social et émotionnel,0,1,0,Synthetic,Bienveillance
Sudan 29.0M Mozambique 3.0M Nigeria 2.8M Yemen 2.3M Syria 1.5M South Sudan 1.5M,0,0,0,UNHAS,
The United Nations Humanitarian Air Service (UNHAS) flies to the rescue of crisis-affected people in the Sahel,0,1,1,UNHAS,
"For example, in Borno State, all primary supply routes are insecure for civilians, humanitarian workers, and supplies.",0,0,1,UNHAS,
Ce produit nous a permis d'améliorer la précision de nos prévisions financières sans augmenter nos dépenses liées à l'analyse des données,1,0,0,Synthetic,Améliorer_sans_augmenter_le_cout
UNHAS | Annual Review 2023 74 Date | Brochure title contracted under a long-term agreement have successfully implemented an environmental management system.,0,1,0,UNHAS,
WOULD YOU          LIKE TO SEE           HOW UNHAS         PERFORMS          AIRLIFTS,0,0,0,UNHAS,
Avec notre solution vos données seront stockées et traitées de manière sécurisée en respectant les normes de confidentialité et de protection des données imposées par les autorités compétentes,0,0,1,Synthetic,Sécurité_des_données
"Acute malnutrition continues to be critical, with a combined prevalence of global acute malnutrition of 10.7 per cent in 2023.",0,0,0,UNHAS,
This was with a fleet of six aircraft — three fixed-wing and three rotary-wing.,0,0,0,UNHAS,
En utilisant cette solution de suivi des dépenses notre entreprise a réussi à identifier et à réduire les gaspillages ce qui a entraîné des économies importantes pour notre organisation,1,0,0,Synthetic,économie_d'argent
"Moreover, Mozambique prone to extreme weather events.",0,0,0,UNHAS,
En permettant aux résidents de participer à des activités de bienêtre et de développement personnel organisées par notre entreprise nous contribuons à renforcer leur confiance en euxmêmes et à améliorer leur estime de soi,0,1,0,Synthetic,Image
Cette solution permet aux entreprises d'améliorer leurs processus de gestion des stocks sans avoir à investir dans de nouveaux systèmes de suivi ou de gestion,1,0,0,Synthetic,Améliorer_sans_investissement
Nos produits intègrent des protocoles de sécurité avancés pour protéger les données sensibles de nos clients et se conformer aux exigences de protection de la vie privée,0,0,1,Synthetic,Contraintes_réglementaire
En raccourcissant le temps de cycle de notre processus de vente nous avons pu conclure des affaires plus rapidement et augmenter nos revenus tout en offrant un meilleur service à nos clients,1,0,0,Synthetic,Réduction_de_temps_de_cycle
Nos solutions offrent une traçabilité complète des accès et des activités permettant à nos clients de répondre aux exigences de reporting et de conservation des données imposées par les réglementations en vigueur,0,0,1,Synthetic,Cybersécurité
Une entreprise de logistique a mis en place cette solution pour optimiser la gestion des déploiements de personnel en fonction des besoins en temps réel réduisant ainsi les coûts opérationnels et augmentant la rentabilité,1,0,0,Synthetic,Réactivité
Un hôtel a utilisé la solution d'optimisation de la stratégie pour analyser les préférences de ses clients personnaliser son offre de services et augmenter son taux d'occupation ainsi que son revenu par chambre disponible,1,0,0,Synthetic,Optimisation_de_la_stratégie
En adoptant des techniques de gestion de projet agiles les entreprises peuvent réduire les retards et les dépassements de budget ce qui peut augmenter leur rentabilité,1,0,0,Synthetic,Rentabilité
Date | Brochure title UNHAS | 2021 Overview UNHAS | Annual Review 2023,0,0,0,UNHAS,
"Dedicated charter flights were operated on behalf of UNOCHA to support  inter-agency missions,  enabling a swift collective response to emerging needs on the ground.",1,1,0,UNHAS,
Nos produits intègrent des mécanismes de validation des documents légaux liés à l'embauche tels que les contrats les déclarations d'embauche et les fiches de paie garantissant ainsi la conformité aux exigences en matière de formalités administratives,0,0,1,Synthetic,Respect_du_droit_de_travail
UNHAS | 2021 Overview 27 Date | Brochure title destinations reached (24 regular | 1 ad hoc),0,0,0,UNHAS,
Grâce à notre système de suivi des horaires de transport en temps réel les résidents peuvent planifier leurs déplacements de manière plus efficace ce qui leur permet d'économiser du temps et du stress,0,1,0,Synthetic,Accès_aux_transports
"These are operated in harsh conditions such as snow, sand, and high and hot environments.",0,0,0,UNHAS,
Burkina Faso 0.5M Mali 0.5M Mozambique 0.3M Niger 0.3M Cameroon 0.1M,0,0,0,UNHAS,
Notre entreprise a investi dans une veille réglementaire permanente afin de garantir que nos produits et solutions restent en conformité avec les évolutions légales et réglementaires,0,0,1,Synthetic,Réglementation
En encourageant la création de réseaux de soutien social notre solution aide les habitants à se sentir plus connectés les uns aux autres et à avoir un impact positif sur la qualité de vie de la communauté dans son ensemble,0,1,0,Synthetic,Cohésion_sociale
"Maximum external load of nearly    3,000 kg.",0,0,0,UNHAS,
En utilisant le pilotage des données une entreprise de vente au détail peut analyser les tendances d'achat des clients pour optimiser son inventaire et éviter les surplus ou les pénuries,1,0,0,Synthetic,Pilotage_des_données
Photo page 36: WFP/Benoît Lognoné,0,0,0,UNHAS,
Avec nos produits vous pourrez prouver facilement et rapidement votre conformité aux autorités compétentes en cas de contrôle ou d'audit,0,0,1,Synthetic,Remise_en_conformité_des_infrastructures_obsolètes
The aircraft is a medium-lift transport rotary-wing that can carry up to 30 passengers and has a cruise speed of 120 knot (220 km/h).,0,0,0,UNHAS,
UNHAS Democratic Republic of the Congo,0,0,0,UNHAS,
"Of those 2 million people, 1.6 million people were considered in need of targeted humanitarian   assistance.",0,0,0,UNHAS,
Cette solution a permis à une entreprise de logistique de mieux planifier et gérer l'utilisation de sa flotte de véhicules réduisant ainsi les temps d'arrêt et les coûts de maintenance,1,0,0,Synthetic,Amélioration_de_temps_d'utiisation_des_equipements
"Since the rehabilitation of the Bassikounou     aerodrome, thanks to  collaboration with the   government, civil aviation authorities, and the donor community, humanitarian workers can reach project implementation sites in the",1,0,0,UNHAS,
Notre solution facilitera la communication entre les citoyens et les instances locales permettant ainsi une plus grande transparence et une meilleure prise en compte des besoins de la communauté,0,1,0,Synthetic,Participation_citoyenne
GHAC Global Humanitarian Aviation    Conference GHO Global Humanitarian Overview GSAT General Aviation Security Awareness HC/RC Humanitarian Coordinator/Resident Coordinator HHMDs Handheld Metal Detectors HQ Headquarters HMI Humanitarian-Military Interaction HRP Humanitarian Response Plan IATA International Air Transport Association ICAO International Civil Aviation Organization,0,0,0,UNHAS,
En mettant en relation les entreprises locales avec les travailleurs qualifiés de la communauté notre solution peut contribuer à renforcer l'économie locale et à créer des emplois durables pour les résidents,0,1,0,Synthetic,Emploi
Notre transition vers des pratiques de fabrication plus durables nous a permis de réduire nos coûts de maintenance des équipements de production de 20%,1,0,0,Synthetic,Rédution_des_coûts_de_fonctionnements
"In such cases, where commercial flights are unavailable and ground transportation is unsafe, UNHAS fills in the crucial gap.",0,0,1,UNHAS,
SHORTFALL)22 | SURPLUS,0,0,0,UNHAS,
Les enfants ayant des besoins spéciaux pourront bénéficier d'une attention plus personnalisée grâce à notre solution qui permettra aux éducateurs de mieux comprendre et répondre à leurs besoins individuels,0,1,0,Synthetic,Offre_de_petite_enfance
This comprehensive support ensures timely   assistance and efficient logistics in crisis zones globally.,1,0,1,UNHAS,
En mettant en place des stations de partage de voitures électriques nous encourageons les habitants à renoncer à posséder une voiture personnelle ce qui réduit l'encombrement des rues et les émissions de gaz à effet de serre,0,1,0,Synthetic,Simplification_de_la_mobilité
This is a kind of airlift in which goods (usually food) are dropped from the aircraft.,0,0,0,UNHAS,
Notre solution favorisera le développement de quartiers durables et écologiques offrant ainsi aux citoyens un environnement sain et respectueux de l'environnement pour vivre travailler et se divertir,0,1,0,Synthetic,Aménagement_urbain
"Incorporating environmental indicators in aircraft procurement processes: Under a new initiative, the WFP Aviation Service developed an environmental component for inclusion in procurement processes.",0,1,0,UNHAS,
Notre engagement en faveur du respect de la propriété intellectuelle se traduit par des mesures proactives pour prévenir et corriger toute violation potentielle des droits de propriété intellectuelle,0,0,1,Synthetic,Respect_de_la_propriété_intellectuelle
En incluant des stratégies de couverture dans la gestion de risque les entreprises peuvent se protéger contre les fluctuations du marché et garantir un retour sur investissement stable même en période d'incertitude économique,1,0,0,Synthetic,Gestion_de_risque
A turboprop-powered commuter airliner with a passenger capacity of 30 to 33.,0,0,0,UNHAS,
Nos produits et solutions sont conçus pour s'adapter facilement aux changements dans les obligations légales et réglementaires liées à Obligation ce qui vous permet de rester agile et proactif dans votre approche de la conformité,0,0,1,Synthetic,Obligation
It has a cruise speed of 420 knots   (780 km/h).,0,0,0,UNHAS,
Nos produits contribuent à réduire votre impact environnemental vous permettant ainsi de respecter les obligations légales en matière de développement durable,0,0,1,Synthetic,Respect_de_l'environnement_au_niveau_légal
Les entreprises du secteur des technologies ont amélioré la performance de leurs applications de 30% en utilisant ce produit ce qui leur a permis de fournir un service plus fiable et de fidéliser leurs clients,1,0,0,Synthetic,Amélioration_de_la_performance_
It's crucial to understand that   UNHAS doesn't aim to replace commercial aviation actors within the countries where it operates.,0,0,0,UNHAS,
En mettant en place des initiatives de nettoyage et d'embellissement des quartiers notre solution renforce le sentiment de fierté des citoyens locaux pour leur environnement et leur communauté,0,1,0,Synthetic,Valorisation_de_la_qualité_environnementale
destinations reached (26 regular | 7 ad hoc),0,0,0,UNHAS,
WFP-managed European Union  Humanitarian Aid Flight,0,0,0,UNHAS,
The E-GPUs are scheduled for delivery to UNHAS Afghanistan within the first quarter of 2024.,0,0,0,UNHAS,
This was through the installation of air navigation radar for the Haiti Civil Aviation authority (OFNAC) as well as training partners to enhance the crucial Airfield Focal Point network.,1,0,1,UNHAS,
En soutenant les initiatives de revitalisation urbaine et de développement communautaire notre solution favorise la création d'emplois dans des secteurs tels que la construction l'entretien des infrastructures et l'aménagement paysager,0,1,0,Synthetic,Réduction_du_chommage
RPAS) humanitarian cargo drone project in collaboration with the International Civil Aviation Organization (ICAO) and the International Air Transport Association (IATA).,0,1,0,UNHAS,
Grâce à nos solutions vous pouvez éviter tout risque de nonconformité et les conséquences juridiques qui en découlent,0,0,1,Synthetic,Remise_en_conformité_des_infrastructures_obsolètes
Grâce à notre solution les résidents peuvent recevoir des alertes en temps réel sur les accidents et les incidents sur la route ce qui les aide à prendre des décisions éclairées pour éviter les zones à problèmes,0,1,0,Synthetic,Fludification_de_la_mobilité
Grâce à notre système de notifications sur les événements locaux les citoyens peuvent être informés des activités culturelles sportives et sociales à proximité enrichissant ainsi leurs loisirs et leur vie sociale,0,1,0,Synthetic,dynamisme
